{
  "$schema": "../contract-fixture.schema.json",
  "fixture_version": 1,
  "sequence_id": "S1",
  "title": "Baseline to approved active plan",
  "contract_tests": ["CT-001", "CT-101", "CT-105", "CT-301", "CT-501"],
  "events": [
    {"event_id":"S1-E01","event_type":"consent.requested","event_version":1,"occurred_at":"2026-08-17T09:00:00Z","recorded_at":"2026-08-17T09:00:01Z","actor":{"type":"user","id":"user:self"},"subject_refs":["consent:C1"],"correlation_id":"corr:S1","causation_id":null,"source_refs":[],"consent_refs":[],"sensitivity":"D1","payload":{"consent_id":"C1","purpose":"image_analysis","data_class":"D3","duration":"session"},"integrity":{"kind":"fixture","digest":"fixture:S1-E01"}},
    {"event_id":"S1-E02","event_type":"consent.granted","event_version":1,"occurred_at":"2026-08-17T09:01:00Z","recorded_at":"2026-08-17T09:01:01Z","actor":{"type":"user","id":"user:self"},"subject_refs":["consent:C1"],"correlation_id":"corr:S1","causation_id":"S1-E01","source_refs":[],"consent_refs":[],"sensitivity":"D1","payload":{"consent_id":"C1"},"integrity":{"kind":"fixture","digest":"fixture:S1-E02"}},
    {"event_id":"S1-E03","event_type":"source.registered","event_version":1,"occurred_at":"2026-08-17T09:02:00Z","recorded_at":"2026-08-17T09:02:01Z","actor":{"type":"user","id":"user:self"},"subject_refs":["source:S1"],"correlation_id":"corr:S1","causation_id":"S1-E02","source_refs":[],"consent_refs":["consent:C1"],"sensitivity":"D3","payload":{"source_id":"S1","kind":"image","content_storage":"metadata_only"},"integrity":{"kind":"fixture","digest":"fixture:S1-E03"}},
    {"event_id":"S1-E04","event_type":"observation.recorded","event_version":1,"occurred_at":"2026-08-17T09:03:00Z","recorded_at":"2026-08-17T09:03:01Z","actor":{"type":"model","id":"model:appearance-v1"},"subject_refs":["observation:O1"],"correlation_id":"corr:S1","causation_id":"S1-E03","source_refs":["source:S1"],"consent_refs":["consent:C1"],"sensitivity":"D3","payload":{"observation_id":"O1","domain":"appearance","attribute":"synthetic_fixture_attribute","value":"present","method":"image_analysis","quality":0.8},"integrity":{"kind":"fixture","digest":"fixture:S1-E04"}},
    {"event_id":"S1-E05","event_type":"claim.proposed","event_version":1,"occurred_at":"2026-08-17T09:04:00Z","recorded_at":"2026-08-17T09:04:01Z","actor":{"type":"model","id":"model:appearance-v1"},"subject_refs":["claim:CL1@1"],"correlation_id":"corr:S1","causation_id":"S1-E04","source_refs":["observation:O1"],"consent_refs":["consent:C1"],"sensitivity":"D3","payload":{"claim_id":"CL1","revision":1,"evidence_refs":["observation:O1"],"confidence":0.7},"integrity":{"kind":"fixture","digest":"fixture:S1-E05"}},
    {"event_id":"S1-E06","event_type":"claim.confirmed","event_version":1,"occurred_at":"2026-08-17T09:05:00Z","recorded_at":"2026-08-17T09:05:01Z","actor":{"type":"user","id":"user:self"},"subject_refs":["claim:CL1@1"],"correlation_id":"corr:S1","causation_id":"S1-E05","source_refs":["observation:O1"],"consent_refs":["consent:C1"],"sensitivity":"D3","payload":{"claim_id":"CL1","revision":1},"integrity":{"kind":"fixture","digest":"fixture:S1-E06"}},
    {"event_id":"S1-E07","event_type":"goal.created","event_version":1,"occurred_at":"2026-08-17T09:06:00Z","recorded_at":"2026-08-17T09:06:01Z","actor":{"type":"user","id":"user:self"},"subject_refs":["goal:G1"],"correlation_id":"corr:S1","causation_id":"S1-E06","source_refs":[],"consent_refs":[],"sensitivity":"D1","payload":{"goal_id":"G1","timebox":{"start":"2026-08-17","end":"2026-09-14"}},"integrity":{"kind":"fixture","digest":"fixture:S1-E07"}},
    {"event_id":"S1-E08","event_type":"goal.activated","event_version":1,"occurred_at":"2026-08-17T09:07:00Z","recorded_at":"2026-08-17T09:07:01Z","actor":{"type":"user","id":"user:self"},"subject_refs":["goal:G1"],"correlation_id":"corr:S1","causation_id":"S1-E07","source_refs":[],"consent_refs":[],"sensitivity":"D1","payload":{"goal_id":"G1"},"integrity":{"kind":"fixture","digest":"fixture:S1-E08"}},
    {"event_id":"S1-E09","event_type":"baseline.created","event_version":1,"occurred_at":"2026-08-17T09:08:00Z","recorded_at":"2026-08-17T09:08:01Z","actor":{"type":"system","id":"core"},"subject_refs":["baseline:B1"],"correlation_id":"corr:S1","causation_id":"S1-E08","source_refs":["observation:O1","claim:CL1@1"],"consent_refs":["consent:C1"],"sensitivity":"D3","payload":{"baseline_id":"B1","refs":["observation:O1","claim:CL1@1"]},"integrity":{"kind":"fixture","digest":"fixture:S1-E09"}},
    {"event_id":"S1-E10","event_type":"opportunity.identified","event_version":1,"occurred_at":"2026-08-17T09:09:00Z","recorded_at":"2026-08-17T09:09:01Z","actor":{"type":"system","id":"core"},"subject_refs":["opportunity:OP1"],"correlation_id":"corr:S1","causation_id":"S1-E09","source_refs":["baseline:B1","goal:G1"],"consent_refs":["consent:C1"],"sensitivity":"D3","payload":{"opportunity_id":"OP1","baseline_ref":"baseline:B1","goal_ref":"goal:G1"},"integrity":{"kind":"fixture","digest":"fixture:S1-E10"}},
    {"event_id":"S1-E11","event_type":"recommendation.created","event_version":1,"occurred_at":"2026-08-17T09:10:00Z","recorded_at":"2026-08-17T09:10:01Z","actor":{"type":"model","id":"model:planner-v1"},"subject_refs":["recommendation:R1"],"correlation_id":"corr:S1","causation_id":"S1-E10","source_refs":["opportunity:OP1"],"consent_refs":["consent:C1"],"sensitivity":"D3","payload":{"recommendation_id":"R1","opportunity_ref":"opportunity:OP1"},"integrity":{"kind":"fixture","digest":"fixture:S1-E11"}},
    {"event_id":"S1-E12","event_type":"plan.drafted","event_version":1,"occurred_at":"2026-08-17T09:11:00Z","recorded_at":"2026-08-17T09:11:01Z","actor":{"type":"system","id":"core"},"subject_refs":["plan:P1"],"correlation_id":"corr:S1","causation_id":"S1-E11","source_refs":["recommendation:R1"],"consent_refs":["consent:C1"],"sensitivity":"D3","payload":{"plan_id":"P1","recommendation_ref":"recommendation:R1","timebox":{"start":"2026-08-18","end":"2026-09-14"}},"integrity":{"kind":"fixture","digest":"fixture:S1-E12"}},
    {"event_id":"S1-E13","event_type":"consent.requested","event_version":1,"occurred_at":"2026-08-17T09:12:00Z","recorded_at":"2026-08-17T09:12:01Z","actor":{"type":"user","id":"user:self"},"subject_refs":["consent:C2","plan:P1"],"correlation_id":"corr:S1","causation_id":"S1-E12","source_refs":[],"consent_refs":[],"sensitivity":"D1","payload":{"consent_id":"C2","purpose":"approve_plan","scope_refs":["plan:P1"],"duration":"plan_timebox"},"integrity":{"kind":"fixture","digest":"fixture:S1-E13"}},
    {"event_id":"S1-E14","event_type":"consent.granted","event_version":1,"occurred_at":"2026-08-17T09:13:00Z","recorded_at":"2026-08-17T09:13:01Z","actor":{"type":"user","id":"user:self"},"subject_refs":["consent:C2"],"correlation_id":"corr:S1","causation_id":"S1-E13","source_refs":[],"consent_refs":[],"sensitivity":"D1","payload":{"consent_id":"C2"},"integrity":{"kind":"fixture","digest":"fixture:S1-E14"}},
    {"event_id":"S1-E15","event_type":"plan.approved","event_version":1,"occurred_at":"2026-08-17T09:14:00Z","recorded_at":"2026-08-17T09:14:01Z","actor":{"type":"user","id":"user:self"},"subject_refs":["plan:P1"],"correlation_id":"corr:S1","causation_id":"S1-E14","source_refs":["recommendation:R1"],"consent_refs":["consent:C2"],"sensitivity":"D3","payload":{"plan_id":"P1","consent_ref":"consent:C2"},"integrity":{"kind":"fixture","digest":"fixture:S1-E15"}},
    {"event_id":"S1-E16","event_type":"plan.activated","event_version":1,"occurred_at":"2026-08-17T09:15:00Z","recorded_at":"2026-08-17T09:15:01Z","actor":{"type":"user","id":"user:self"},"subject_refs":["plan:P1"],"correlation_id":"corr:S1","causation_id":"S1-E15","source_refs":[],"consent_refs":["consent:C2"],"sensitivity":"D3","payload":{"plan_id":"P1"},"integrity":{"kind":"fixture","digest":"fixture:S1-E16"}},
    {"event_id":"S1-E17","event_type":"task.planned","event_version":1,"occurred_at":"2026-08-17T09:16:00Z","recorded_at":"2026-08-17T09:16:01Z","actor":{"type":"system","id":"core"},"subject_refs":["task:T1"],"correlation_id":"corr:S1","causation_id":"S1-E16","source_refs":["plan:P1"],"consent_refs":["consent:C2"],"sensitivity":"D2","payload":{"task_id":"T1","plan_ref":"plan:P1"},"integrity":{"kind":"fixture","digest":"fixture:S1-E17"}}
  ],
  "expectations": {
    "event_results": [
      {"event_id":"S1-E01","result":"applied"},{"event_id":"S1-E02","result":"applied"},{"event_id":"S1-E03","result":"applied"},{"event_id":"S1-E04","result":"applied"},{"event_id":"S1-E05","result":"applied"},{"event_id":"S1-E06","result":"applied"},{"event_id":"S1-E07","result":"applied"},{"event_id":"S1-E08","result":"applied"},{"event_id":"S1-E09","result":"applied"},{"event_id":"S1-E10","result":"applied"},{"event_id":"S1-E11","result":"applied"},{"event_id":"S1-E12","result":"applied"},{"event_id":"S1-E13","result":"applied"},{"event_id":"S1-E14","result":"applied"},{"event_id":"S1-E15","result":"applied"},{"event_id":"S1-E16","result":"applied"},{"event_id":"S1-E17","result":"applied"}
    ],
    "projection_assertions": [
      {"path":"/plans/P1/status","equals":"active"},
      {"path":"/tasks/T1/status","equals":"planned"},
      {"path":"/claims/CL1/current_revision","equals":1},
      {"path":"/claims/CL1/revisions/1/status","equals":"confirmed"},
      {"path":"/consents/C1/status","equals":"granted"},
      {"path":"/consents/C2/status","equals":"granted"}
    ],
    "invariants": ["active_plan_has_valid_consent","active_plan_has_finite_timebox","recommendation_is_traceable_to_goal_and_evidence"]
  }
}
