{
  "$schema": "../contract-fixture.schema.json",
  "fixture_version": 1,
  "sequence_id": "S2",
  "title": "Accepted review revises the current claim",
  "contract_tests": ["CT-204", "CT-205", "CT-401", "CT-502"],
  "events": [
    {"event_id":"S2-E01","event_type":"task.planned","event_version":1,"occurred_at":"2026-08-18T08:00:00Z","recorded_at":"2026-08-18T08:00:01Z","actor":{"type":"system","id":"core"},"subject_refs":["task:T1"],"correlation_id":"corr:S2","causation_id":null,"source_refs":["plan:P1"],"consent_refs":["consent:C2"],"sensitivity":"D2","payload":{"task_id":"T1","plan_ref":"plan:P1"},"integrity":{"kind":"fixture","digest":"fixture:S2-E01"}},
    {"event_id":"S2-E02","event_type":"task.ready","event_version":1,"occurred_at":"2026-08-18T08:01:00Z","recorded_at":"2026-08-18T08:01:01Z","actor":{"type":"user","id":"user:self"},"subject_refs":["task:T1"],"correlation_id":"corr:S2","causation_id":"S2-E01","source_refs":[],"consent_refs":["consent:C2"],"sensitivity":"D2","payload":{"task_id":"T1"},"integrity":{"kind":"fixture","digest":"fixture:S2-E02"}},
    {"event_id":"S2-E03","event_type":"task.in_progress","event_version":1,"occurred_at":"2026-08-18T08:02:00Z","recorded_at":"2026-08-18T08:02:01Z","actor":{"type":"user","id":"user:self"},"subject_refs":["task:T1"],"correlation_id":"corr:S2","causation_id":"S2-E02","source_refs":[],"consent_refs":["consent:C2"],"sensitivity":"D2","payload":{"task_id":"T1"},"integrity":{"kind":"fixture","digest":"fixture:S2-E03"}},
    {"event_id":"S2-E04","event_type":"execution.recorded","event_version":1,"occurred_at":"2026-08-18T08:30:00Z","recorded_at":"2026-08-18T08:30:01Z","actor":{"type":"user","id":"user:self"},"subject_refs":["execution:E1","task:T1"],"correlation_id":"corr:S2","causation_id":"S2-E03","source_refs":[],"consent_refs":["consent:C2"],"sensitivity":"D2","payload":{"execution_id":"E1","task_ref":"task:T1","actual":true},"integrity":{"kind":"fixture","digest":"fixture:S2-E04"}},
    {"event_id":"S2-E05","event_type":"task.completed","event_version":1,"occurred_at":"2026-08-18T08:31:00Z","recorded_at":"2026-08-18T08:31:01Z","actor":{"type":"user","id":"user:self"},"subject_refs":["task:T1"],"correlation_id":"corr:S2","causation_id":"S2-E04","source_refs":["execution:E1"],"consent_refs":["consent:C2"],"sensitivity":"D2","payload":{"task_id":"T1","execution_ref":"execution:E1"},"integrity":{"kind":"fixture","digest":"fixture:S2-E05"}},
    {"event_id":"S2-E06","event_type":"outcome.recorded","event_version":1,"occurred_at":"2026-08-19T08:00:00Z","recorded_at":"2026-08-19T08:00:01Z","actor":{"type":"user","id":"user:self"},"subject_refs":["outcome:O2"],"correlation_id":"corr:S2","causation_id":"S2-E05","source_refs":["task:T1"],"consent_refs":["consent:C2"],"sensitivity":"D2","payload":{"outcome_id":"O2","relates_to":"task:T1"},"integrity":{"kind":"fixture","digest":"fixture:S2-E06"}},
    {"event_id":"S2-E07","event_type":"review.created","event_version":1,"occurred_at":"2026-08-19T08:01:00Z","recorded_at":"2026-08-19T08:01:01Z","actor":{"type":"system","id":"core"},"subject_refs":["review:RV1"],"correlation_id":"corr:S2","causation_id":"S2-E06","source_refs":["baseline:B1","plan:P1","outcome:O2"],"consent_refs":["consent:C2"],"sensitivity":"D3","payload":{"review_id":"RV1","baseline_ref":"baseline:B1","plan_ref":"plan:P1","outcome_refs":["outcome:O2"]},"integrity":{"kind":"fixture","digest":"fixture:S2-E07"}},
    {"event_id":"S2-E08","event_type":"review.user_reviewed","event_version":1,"occurred_at":"2026-08-19T08:02:00Z","recorded_at":"2026-08-19T08:02:01Z","actor":{"type":"user","id":"user:self"},"subject_refs":["review:RV1"],"correlation_id":"corr:S2","causation_id":"S2-E07","source_refs":[],"consent_refs":[],"sensitivity":"D3","payload":{"review_id":"RV1"},"integrity":{"kind":"fixture","digest":"fixture:S2-E08"}},
    {"event_id":"S2-E09","event_type":"review.accepted","event_version":1,"occurred_at":"2026-08-19T08:03:00Z","recorded_at":"2026-08-19T08:03:01Z","actor":{"type":"user","id":"user:self"},"subject_refs":["review:RV1"],"correlation_id":"corr:S2","causation_id":"S2-E08","source_refs":[],"consent_refs":[],"sensitivity":"D3","payload":{"review_id":"RV1"},"integrity":{"kind":"fixture","digest":"fixture:S2-E09"}},
    {"event_id":"S2-E10","event_type":"model.revision.proposed","event_version":1,"occurred_at":"2026-08-19T08:04:00Z","recorded_at":"2026-08-19T08:04:01Z","actor":{"type":"model","id":"model:appearance-v1"},"subject_refs":["model_revision:MR1"],"correlation_id":"corr:S2","causation_id":"S2-E09","source_refs":["review:RV1","claim:CL1@1"],"consent_refs":[],"sensitivity":"D3","payload":{"model_revision_id":"MR1","from_claim_ref":"claim:CL1@1","to_claim_ref":"claim:CL2@1","cause_ref":"review:RV1"},"integrity":{"kind":"fixture","digest":"fixture:S2-E10"}},
    {"event_id":"S2-E11","event_type":"claim.proposed","event_version":1,"occurred_at":"2026-08-19T08:05:00Z","recorded_at":"2026-08-19T08:05:01Z","actor":{"type":"model","id":"model:appearance-v1"},"subject_refs":["claim:CL2@1"],"correlation_id":"corr:S2","causation_id":"S2-E10","source_refs":["review:RV1"],"consent_refs":[],"sensitivity":"D3","payload":{"claim_id":"CL2","revision":1,"supersedes":"claim:CL1@1","evidence_refs":["review:RV1"]},"integrity":{"kind":"fixture","digest":"fixture:S2-E11"}},
    {"event_id":"S2-E12","event_type":"claim.confirmed","event_version":1,"occurred_at":"2026-08-19T08:06:00Z","recorded_at":"2026-08-19T08:06:01Z","actor":{"type":"user","id":"user:self"},"subject_refs":["claim:CL2@1"],"correlation_id":"corr:S2","causation_id":"S2-E11","source_refs":["review:RV1"],"consent_refs":[],"sensitivity":"D3","payload":{"claim_id":"CL2","revision":1},"integrity":{"kind":"fixture","digest":"fixture:S2-E12"}},
    {"event_id":"S2-E13","event_type":"claim.withdrawn","event_version":1,"occurred_at":"2026-08-19T08:07:00Z","recorded_at":"2026-08-19T08:07:01Z","actor":{"type":"system","id":"core"},"subject_refs":["claim:CL1@1"],"correlation_id":"corr:S2","causation_id":"S2-E12","source_refs":["claim:CL2@1"],"consent_refs":[],"sensitivity":"D3","payload":{"claim_id":"CL1","revision":1,"superseded_by":"claim:CL2@1"},"integrity":{"kind":"fixture","digest":"fixture:S2-E13"}},
    {"event_id":"S2-E14","event_type":"model.revision.accepted","event_version":1,"occurred_at":"2026-08-19T08:08:00Z","recorded_at":"2026-08-19T08:08:01Z","actor":{"type":"user","id":"user:self"},"subject_refs":["model_revision:MR1"],"correlation_id":"corr:S2","causation_id":"S2-E13","source_refs":["review:RV1"],"consent_refs":[],"sensitivity":"D3","payload":{"model_revision_id":"MR1"},"integrity":{"kind":"fixture","digest":"fixture:S2-E14"}},
    {"event_id":"S2-E15","event_type":"plan.completed","event_version":1,"occurred_at":"2026-08-19T08:09:00Z","recorded_at":"2026-08-19T08:09:01Z","actor":{"type":"user","id":"user:self"},"subject_refs":["plan:P1"],"correlation_id":"corr:S2","causation_id":"S2-E14","source_refs":["review:RV1"],"consent_refs":["consent:C2"],"sensitivity":"D3","payload":{"plan_id":"P1"},"integrity":{"kind":"fixture","digest":"fixture:S2-E15"}}
  ],
  "expectations": {
    "event_results": [
      {"event_id":"S2-E01","result":"applied"},{"event_id":"S2-E02","result":"applied"},{"event_id":"S2-E03","result":"applied"},{"event_id":"S2-E04","result":"applied"},{"event_id":"S2-E05","result":"applied"},{"event_id":"S2-E06","result":"applied"},{"event_id":"S2-E07","result":"applied"},{"event_id":"S2-E08","result":"applied"},{"event_id":"S2-E09","result":"applied"},{"event_id":"S2-E10","result":"applied"},{"event_id":"S2-E11","result":"applied"},{"event_id":"S2-E12","result":"applied"},{"event_id":"S2-E13","result":"applied"},{"event_id":"S2-E14","result":"applied"},{"event_id":"S2-E15","result":"applied"}
    ],
    "projection_assertions": [
      {"path":"/tasks/T1/status","equals":"completed"},
      {"path":"/reviews/RV1/status","equals":"accepted"},
      {"path":"/claims/CL1/revisions/1/status","equals":"withdrawn"},
      {"path":"/current_claims/appearance","equals":"claim:CL2@1"},
      {"path":"/plans/P1/status","equals":"completed"}
    ],
    "invariants": ["review_acceptance_precedes_current_claim_change","withdrawn_claim_excluded_from_current_recommendations","old_claim_revision_remains_auditable"]
  }
}
